{
  "correo_id": "MAIL-2026-10-23-014",
  "de": "planning@hermana-us.example",
  "para": ["ana@c1.example", "andres@c1.example"],
  "fecha": "2026-10-23T15:02:00-06:00",
  "asunto": "Tyvek lot change - possible delay",
  "planta_origen": "hermana-us-01",
  "tipo": "cambio_fecha",
  "orden_afectada": "ORD-2026-0042",
  "rollo_id": "R-017",
  "fecha_promesa_nueva": "2026-10-30",
  "adjunto_id": null,
  "requiere_accion": true,
  "idioma": "en"
}
